{
  "version": "1.0.0",
  "trace_id": "trace-mkqy0fa8-njrnbg",
  "created_at": "2026-01-23T13:55:04.160Z",
  "summary": "Task approved. All proposed actions passed gate and contract checks.",
  "why": [
    "All checks passed without issues"
  ],
  "what_changed": [],
  "what_blocked": [],
  "next_steps": [
    "Proceed with execution"
  ],
  "confidence": 1
}